{
  "schema_version": 3,
  "submission_state": "draft",
  "target_profile": "sha3-256-r5-prefix-v1",
  "attack_class": "ordinary-collision",
  "rounds": 5,
  "claim": {
    "time_log2": 128.0,
    "time_unit": "target-compressions",
    "memory_log2_bytes": 0,
    "preprocessing_log2": 0,
    "success_probability": 0.39,
    "nonuniform_advice_log2_bytes": 0
  },
  "restrictions": [],
  "baseline_improved": "sha3-256-r5-nominal-v2",
  "certificate_manifest": "certificates/manifest.json",
  "lane": "exploratory",
  "heuristics": []
}
